{
  "$schema": "https://json-schema.org/draft/2020-12/schema",
  "$id": "https://quoralinex.github.io/AI-Delivery-Standard/schemas/project-delivery-index.schema.json",
  "title": "Project Delivery Index",
  "type": "object",
  "additionalProperties": false,
  "properties": {
    "schema_version": {
      "const": "1.0.0"
    },
    "standard": {
      "const": "AI-Delivery-Standard"
    },
    "standard_version": {
      "type": "string",
      "minLength": 1
    },
    "project": {
      "type": "object",
      "additionalProperties": false,
      "properties": {
        "id": {
          "type": "string",
          "minLength": 1
        },
        "name": {
          "type": "string",
          "minLength": 1
        }
      },
      "required": [
        "id",
        "name"
      ]
    },
    "status": {
      "type": "string",
      "enum": [
        "DRAFT",
        "ACTIVE",
        "CLOSED",
        "SUPERSEDED",
        "BLOCKED"
      ]
    },
    "deliveries": {
      "type": "array",
      "items": {
        "type": "object",
        "additionalProperties": false,
        "properties": {
          "id": {
            "type": "string",
            "minLength": 1
          },
          "title": {
            "type": "string",
            "minLength": 1
          },
          "status": {
            "type": "string",
            "enum": [
              "CLOSED",
              "SUPERSEDED"
            ]
          },
          "manifest": {
            "type": "string",
            "minLength": 1
          },
          "supersedes": {
            "type": "array",
            "items": {
              "type": "string",
              "minLength": 1
            }
          },
          "depends_on": {
            "type": "array",
            "items": {
              "type": "string",
              "minLength": 1
            }
          }
        },
        "required": [
          "id",
          "title",
          "status",
          "manifest",
          "supersedes",
          "depends_on"
        ]
      }
    },
    "unpackaged_deliveries": {
      "type": "array",
      "items": {
        "type": "object",
        "additionalProperties": false,
        "properties": {
          "title": {
            "type": "string",
            "minLength": 1
          },
          "evidence": {
            "type": "array",
            "items": {
              "type": "string",
              "minLength": 1
            }
          }
        },
        "required": [
          "title",
          "evidence"
        ]
      }
    },
    "source_coverage": {
      "$ref": "https://quoralinex.github.io/AI-Delivery-Standard/schemas/source-coverage.schema.json"
    },
    "updated_at": {
      "type": "string",
      "format": "date-time"
    }
  },
  "required": [
    "schema_version",
    "standard",
    "standard_version",
    "project",
    "status",
    "deliveries",
    "unpackaged_deliveries",
    "source_coverage",
    "updated_at"
  ]
}
