{
  "schema_version": "1.0.0",
  "standard": "AI-Delivery-Standard",
  "standard_version": "1.0.0",
  "project": {
    "id": "replace-me",
    "name": "Replace Me"
  },
  "status": "ACTIVE",
  "deliveries": [],
  "unpackaged_deliveries": [],
  "source_coverage": {
    "schema_version": "1.0.0",
    "status": "INCOMPLETE",
    "sources": [],
    "known_missing_sources": [],
    "notes": "Populate by discovering all accessible project sources; do not assume the active conversation is complete."
  },
  "updated_at": "1970-01-01T00:00:00Z"
}
